MCQ,Choices,Correct
Who coined the term 'machine learning' in 1959?,a:Arthur Samuel | b:Raytheon Company | c:Donald Hebb | d:Warren McCulloch,a
Which of the following researchers proposed early mathematical models of neural networks?,a:Walter Pitts and Warren McCulloch | b:Arthur Samuel | c:Raytheon Company | d:Nilsson,a
What was the objective of the 'learning machine' developed by Raytheon Company in the early 1960s?,"a:To analyze sonar signals, electrocardiograms, and speech patterns using reinforcement learning | b:To classify data based on models | c:To make predictions for future outcomes based on models | d:To develop a theoretical neural structure",a
What is Tom M. Mitchell's definition of machine learning?,"a:A computer program is said to learn from experience E with respect to some class of tasks T and performance measure P if its performance at tasks in T, as measured by P, improves with experience E. | b:Can machines think? | c:Can machines do what we (as thinking entities) can do? | d:The Organization of Behavior",a
What are the two objectives of modern-day machine learning?,"a:To classify data based on models and to make predictions for future outcomes based on these models | b:To analyze sonar signals, electrocardiograms, and speech patterns using reinforcement learning | c:To develop a theoretical neural structure and to make predictions for future outcomes based on these models | d:To classify data based on models and to replace the question 'Can machines think?' with 'Can machines do what we (as thinking entities) can do?'",a
